{"$schema":"./schema/osui.utilities.schema.json","version":"1","source":"scripts/docs-ai-generator/generate-ai-docs.mjs","grammar":{"pattern":"<property>[-<side>][-<value>]","heads":["margin","padding","display","flex-direction","flex-wrap","flex","justify-content","align-items","align-content","align-self","gap","row-gap","column-gap","background","text","font-size","font","border-radius","border-size","border","shadow","position","overflow","width","height","white-space","shape"],"sides":["top","bottom","left","right","x","y"],"steps":["none","xs","s","base","m","l","xl","xxl"],"shades":["lightest","lighter","light","dark","darker","darkest"],"hues":["blue","cyan","grape","green","indigo","lime","orange","pink","red","teal","violet","yellow","primary","secondary","error","info","success","warning"]},"families":[{"name":"a11y","title":"Accessibility","file":"src/scss/05-useful/_a11y.scss","classes":[{"name":"wcag-hide-text","conformant":false,"canonical":null,"template":"wcag-hide-text","declarations":[{"prop":"border","value":"0","important":false},{"prop":"clip","value":"rect(0 0 0 0)","important":false},{"prop":"height","value":"1px","important":false},{"prop":"margin","value":"-1px","important":false},{"prop":"overflow","value":"hidden","important":false},{"prop":"padding","value":"0","important":false},{"prop":"position","value":"absolute","important":false},{"prop":"white-space","value":"nowrap","important":false},{"prop":"width","value":"1px","important":false},{"prop":"-servicestudio-display","value":"none","important":false}],"variants":[{"context":".focus-trap-top","declarations":[{"prop":"position","value":"fixed","important":false}]},{"context":".focus-trap-bottom","declarations":[{"prop":"position","value":"fixed","important":false}]}],"tokens":[]},{"name":"skip-nav","conformant":false,"canonical":null,"template":"skip-nav","declarations":[{"prop":"inset-inline-start","value":"var(--token-scale-1000, 40px)","important":false},{"prop":"opacity","value":"0","important":false},{"prop":"padding-block","value":"var(--token-scale-200, 8px)","important":false},{"prop":"padding-inline","value":"var(--token-scale-400, 16px)","important":false},{"prop":"pointer-events","value":"none","important":false},{"prop":"position","value":"absolute","important":false},{"prop":"text-transform","value":"uppercase","important":false},{"prop":"top","value":"10px","important":false},{"prop":"z-index","value":"var(--layer-global-instant-interaction)","important":false}],"variants":[{"context":"[data-showskipcontent=false]","declarations":[{"prop":"display","value":"none","important":false}]},{"context":"[data-showskipcontent=true]","declarations":[{"prop":"display","value":"block","important":false}]},{"context":".has-accessible-features :focus","declarations":[{"prop":"opacity","value":"1","important":false},{"prop":"pointer-events","value":"auto","important":false}]},{"context":".has-accessible-features :active","declarations":[{"prop":"opacity","value":"1","important":false},{"prop":"pointer-events","value":"auto","important":false}]}],"tokens":["--token-scale-1000","--token-scale-200","--token-scale-400","--layer-global-instant-interaction"]}]},{"name":"border-radius","title":"Border radius & shape","file":"src/scss/05-useful/_border-radius.scss","classes":[{"name":"shape-soft","conformant":true,"canonical":null,"template":"shape-soft","declarations":[{"prop":"--border-radius-2xs","value":"var(--token-shape-soft-2xs, 4px)","important":false},{"prop":"--border-radius-xs","value":"var(--token-shape-soft-xs, 8px)","important":false},{"prop":"--border-radius-sm","value":"var(--token-shape-soft-sm, 12px)","important":false},{"prop":"--border-radius-md","value":"var(--token-shape-soft-md, 16px)","important":false},{"prop":"--border-radius-lg","value":"var(--token-shape-soft-lg, 8px)","important":false},{"prop":"--border-radius-xl","value":"var(--token-shape-soft-xl, 12px)","important":false},{"prop":"--border-radius-2xl","value":"var(--token-shape-soft-2xl, 16px)","important":false}],"variants":[],"tokens":["--token-shape-soft-2xs","--token-shape-soft-xs","--token-shape-soft-sm","--token-shape-soft-md","--token-shape-soft-lg","--token-shape-soft-xl","--token-shape-soft-2xl"]},{"name":"shape-round","conformant":true,"canonical":null,"template":"shape-round","declarations":[{"prop":"--border-radius-2xs","value":"var(--token-shape-round-2xs, 999px)","important":false},{"prop":"--border-radius-xs","value":"var(--token-shape-round-xs, 999px)","important":false},{"prop":"--border-radius-sm","value":"var(--token-shape-round-sm, 999px)","important":false},{"prop":"--border-radius-md","value":"var(--token-shape-round-md, 999px)","important":false},{"prop":"--border-radius-lg","value":"var(--token-shape-round-lg, 12px)","important":false},{"prop":"--border-radius-xl","value":"var(--token-shape-round-xl, 16px)","important":false},{"prop":"--border-radius-2xl","value":"var(--token-shape-round-2xl, 40px)","important":false}],"variants":[],"tokens":["--token-shape-round-2xs","--token-shape-round-xs","--token-shape-round-sm","--token-shape-round-md","--token-shape-round-lg","--token-shape-round-xl","--token-shape-round-2xl"]},{"name":"shape-rectangular","conformant":true,"canonical":null,"template":"shape-rectangular","declarations":[{"prop":"--border-radius-2xs","value":"var(--token-shape-rectangular-2xs, 0px)","important":false},{"prop":"--border-radius-xs","value":"var(--token-shape-rectangular-xs, 0px)","important":false},{"prop":"--border-radius-sm","value":"var(--token-shape-rectangular-sm, 0px)","important":false},{"prop":"--border-radius-md","value":"var(--token-shape-rectangular-md, 0px)","important":false},{"prop":"--border-radius-lg","value":"var(--token-shape-rectangular-lg, 0px)","important":false},{"prop":"--border-radius-xl","value":"var(--token-shape-rectangular-xl, 0px)","important":false},{"prop":"--border-radius-2xl","value":"var(--token-shape-rectangular-2xl, 0px)","important":false}],"variants":[],"tokens":["--token-shape-rectangular-2xs","--token-shape-rectangular-xs","--token-shape-rectangular-sm","--token-shape-rectangular-md","--token-shape-rectangular-lg","--token-shape-rectangular-xl","--token-shape-rectangular-2xl"]},{"name":"border-radius-none","conformant":true,"canonical":null,"template":"border-radius-{radius}","declarations":[{"prop":"border-radius","value":"var(--token-border-radius-0, var(--token-scale-0, 0px))","important":false}],"variants":[],"tokens":["--token-border-radius-0","--token-scale-0"]},{"name":"border-radius-top-left-none","conformant":true,"canonical":null,"template":"border-radius-{side}-{side}-{radius}","declarations":[{"prop":"border-top-left-radius","value":"var(--token-border-radius-0, var(--token-scale-0, 0px))","important":false}],"variants":[],"tokens":["--token-border-radius-0","--token-scale-0"]},{"name":"border-radius-top-right-none","conformant":true,"canonical":null,"template":"border-radius-{side}-{side}-{radius}","declarations":[{"prop":"border-top-right-radius","value":"var(--token-border-radius-0, var(--token-scale-0, 0px))","important":false}],"variants":[],"tokens":["--token-border-radius-0","--token-scale-0"]},{"name":"border-radius-bottom-right-none","conformant":true,"canonical":null,"template":"border-radius-{side}-{side}-{radius}","declarations":[{"prop":"border-bottom-right-radius","value":"var(--token-border-radius-0, var(--token-scale-0, 0px))","important":false}],"variants":[],"tokens":["--token-border-radius-0","--token-scale-0"]},{"name":"border-radius-bottom-left-none","conformant":true,"canonical":null,"template":"border-radius-{side}-{side}-{radius}","declarations":[{"prop":"border-bottom-left-radius","value":"var(--token-border-radius-0, var(--token-scale-0, 0px))","important":false}],"variants":[],"tokens":["--token-border-radius-0","--token-scale-0"]},{"name":"border-radius-top-none","conformant":true,"canonical":null,"template":"border-radius-{side}-{radius}","declarations":[{"prop":"border-top-left-radius","value":"var(--token-border-radius-0, var(--token-scale-0, 0px))","important":false},{"prop":"border-top-right-radius","value":"var(--token-border-radius-0, var(--token-scale-0, 0px))","important":false}],"variants":[],"tokens":["--token-border-radius-0","--token-scale-0"]},{"name":"border-radius-bottom-none","conformant":true,"canonical":null,"template":"border-radius-{side}-{radius}","declarations":[{"prop":"border-bottom-left-radius","value":"var(--token-border-radius-0, var(--token-scale-0, 0px))","important":false},{"prop":"border-bottom-right-radius","value":"var(--token-border-radius-0, var(--token-scale-0, 0px))","important":false}],"variants":[],"tokens":["--token-border-radius-0","--token-scale-0"]},{"name":"border-radius-soft","conformant":true,"canonical":null,"template":"border-radius-{radius}","declarations":[{"prop":"border-radius","value":"var(--token-border-radius-100, var(--token-scale-100, 4px))","important":false}],"variants":[],"tokens":["--token-border-radius-100","--token-scale-100"]},{"name":"border-radius-top-left-soft","conformant":true,"canonical":null,"template":"border-radius-{side}-{side}-{radius}","declarations":[{"prop":"border-top-left-radius","value":"var(--token-border-radius-100, var(--token-scale-100, 4px))","important":false}],"variants":[],"tokens":["--token-border-radius-100","--token-scale-100"]},{"name":"border-radius-top-right-soft","conformant":true,"canonical":null,"template":"border-radius-{side}-{side}-{radius}","declarations":[{"prop":"border-top-right-radius","value":"var(--token-border-radius-100, var(--token-scale-100, 4px))","important":false}],"variants":[],"tokens":["--token-border-radius-100","--token-scale-100"]},{"name":"border-radius-bottom-right-soft","conformant":true,"canonical":null,"template":"border-radius-{side}-{side}-{radius}","declarations":[{"prop":"border-bottom-right-radius","value":"var(--token-border-radius-100, var(--token-scale-100, 4px))","important":false}],"variants":[],"